{"artifactId":"c7f83255-d629-476f-9ce4-6228aaf71b83","schema":"oan.hopng_transform_history","schemaVersion":"0.1.0","transforms":[{"actor":"Reference Builder","description":"Created Phase 1 HOPNG artifact foundation.","kind":"artifact-foundation","stepId":"genesis","timestampUtc":"2026-03-30T17:13:54.8984339\u002B00:00"}]}