{"artifactId":"a543ba2e-9cc4-40aa-a2be-f6215f33c714","schema":"oan.hopng_transform_history","schemaVersion":"0.1.0","transforms":[{"actor":"Local Tester","description":"Created Phase 1 HOPNG artifact foundation.","kind":"artifact-foundation","stepId":"genesis","timestampUtc":"2026-03-30T07:33:43.2194102\u002B00:00"}]}