{"artifactId":"f196120c-0fed-4d44-944c-0da60949710a","schema":"oan.hopng_transform_history","schemaVersion":"0.1.0","transforms":[{"actor":"Rober","description":"Created Phase 1 HOPNG artifact foundation.","kind":"artifact-foundation","stepId":"genesis","timestampUtc":"2026-03-30T07:50:29.6923219\u002B00:00"}]}