{"artifactId":"a79dc016-dfdf-419b-8ddb-5aa7bf1f2933","schema":"oan.hopng_transform_history","schemaVersion":"0.1.0","transforms":[{"actor":"tester","description":"Created Phase 1 HOPNG artifact foundation.","kind":"artifact-foundation","stepId":"genesis","timestampUtc":"2026-03-07T00:48:04.6541345\u002B00:00"}]}