{"artifactId":"46634047-d451-4ffe-86f5-ee1825df8d08","schema":"oan.hopng_transform_history","schemaVersion":"0.1.0","transforms":[{"actor":"Rober","description":"Created Phase 1 HOPNG artifact foundation.","kind":"artifact-foundation","stepId":"genesis","timestampUtc":"2026-03-19T00:24:04.6398922\u002B00:00"}]}